{
  "$schema": "../../../../../schema/artifact.schema.json",
  "schemaVersion": 1,
  "id": "skill/marketing/analytics/reconcile-marketing-attribution",
  "slug": "reconcile-marketing-attribution",
  "name": "Reconcile Marketing Attribution",
  "version": "1.3.0",
  "kind": "skill",
  "summary": "Reconcile conflicting channel credit while preserving uncertainty and causal limits.",
  "description": "Reconcile marketing attribution across analytics, advertising, CRM, billing, self-reported, and experimental evidence. Use when dashboards disagree or a budget decision needs a transparent view of identity gaps, model assumptions, and incrementality.",
  "domain": "marketing",
  "category": "analytics",
  "problems": [
    "attribution"
  ],
  "frameworks": [
    "agnostic"
  ],
  "languages": [
    "agnostic"
  ],
  "lifecycle": [
    "discovery",
    "review",
    "operations"
  ],
  "risk": "medium",
  "risk_reason": "This skill reconciles conflicting channel credit while preserving uncertainty and causal limits; it does not expose individual journeys or bypass consent to close identity gaps.",
  "license": "MIT",
  "authors": [
    "Youdede"
  ],
  "refuses": [
    "It does not select the most favorable dashboard or silently merge incompatible conversion definitions.",
    "It does not expose individual journeys or bypass consent to close identity gaps.",
    "It does not call attributed revenue incremental revenue without experimental or model-based causal support."
  ],
  "execution": {
    "mode": "prompt",
    "entrypoints": []
  },
  "adapters": {
    "claude-code": "adapters/claude-code.json",
    "codex": "adapters/codex.json",
    "gemini-cli": "adapters/gemini-cli.json",
    "github-copilot": "adapters/github-copilot.json",
    "cursor": "adapters/cursor.json",
    "opencode": "adapters/opencode.json"
  },
  "capabilities": [
    "operate"
  ],
  "relationships": {
    "composesWith": [],
    "conflictsWith": [],
    "supersedes": [],
    "prerequisites": [],
    "packIds": []
  },
  "operational": {
    "behavior": "advisory",
    "failurePolicy": "stop-and-report",
    "latencyClass": "bounded",
    "latency_reason": "The skill reconciles conflicting channel credit while preserving uncertainty and causal limits, using sequential evidence and verification steps.",
    "dataRetention": "runtime-managed"
  }
}
