{
  "$schema": "../../../../../schema/artifact.schema.json",
  "schemaVersion": 1,
  "id": "hook/development/assertion-integrity/test-assertion-removal-guard",
  "slug": "test-assertion-removal-guard",
  "name": "Test Assertion Removal Guard",
  "version": "1.0.0",
  "kind": "hook",
  "summary": "Block removal of the last recognizable assertion from an existing test file.",
  "description": "Compares bounded test-file revisions and stops a change when a test that stays in the file loses every recognizable assertion or failure primitive.",
  "domain": "development",
  "category": "assertion-integrity",
  "problems": [
    "test-assertion-integrity"
  ],
  "frameworks": [
    "agnostic"
  ],
  "languages": [
    "agnostic"
  ],
  "lifecycle": [
    "implementation",
    "pre-commit"
  ],
  "risk": "medium",
  "risk_reason": "This automatic gate blocks removal of the last recognizable assertion from an existing test file; a false denial can interrupt legitimate work, but it does not execute the blocked action.",
  "license": "MIT",
  "authors": [
    "Youdede"
  ],
  "refuses": [
    "It does not judge assertion quality or test coverage.",
    "It does not block assertion-preserving refactors recognized by its bounded vocabulary.",
    "It does not govern skipped or deleted test cases."
  ],
  "execution": {
    "mode": "deterministic",
    "entrypoints": [
      {
        "path": "targets/claude-code/test-assertion-removal-guard.mjs",
        "runtime": "node",
        "purpose": "Block removal of the last recognizable assertion from an existing test file.",
        "sideEffects": "read-only"
      }
    ]
  },
  "adapters": {
    "claude-code": "adapters/claude-code.json"
  },
  "capabilities": [
    "enforce"
  ],
  "relationships": {
    "composesWith": [],
    "conflictsWith": [],
    "supersedes": [],
    "prerequisites": [],
    "packIds": []
  },
  "operational": {
    "behavior": "enforcing",
    "failurePolicy": "fail-closed",
    "latencyClass": "immediate",
    "latency_reason": "The entrypoint handles one intercepted event to block removal of the last recognizable assertion from an existing test file without deferred work.",
    "dataRetention": "none"
  }
}
