{
  "$schema": "../../../../../schema/artifact.schema.json",
  "schemaVersion": 1,
  "id": "skill/marketing/growth/design-qualified-lead-magnet",
  "slug": "design-qualified-lead-magnet",
  "name": "Design Qualified Lead Magnet",
  "version": "1.4.0",
  "kind": "skill",
  "summary": "Design an optional resource that delivers standalone value and signals genuine customer fit.",
  "description": "Design a guide, template, benchmark, checklist, diagnostic, or resource that creates standalone value and attracts qualified demand. Use when a team needs a lead magnet aligned with a real audience job and a consent-aware follow-up path.",
  "domain": "marketing",
  "category": "growth",
  "problems": [
    "lead-magnet"
  ],
  "frameworks": [
    "agnostic"
  ],
  "languages": [
    "agnostic"
  ],
  "lifecycle": [
    "discovery",
    "planning",
    "implementation"
  ],
  "risk": "medium",
  "risk_reason": "This skill designs an optional resource that delivers standalone value and signals genuine customer fit; it does not require unnecessary personal data or preselect promotional consent.",
  "license": "MIT",
  "authors": [
    "Youdede"
  ],
  "refuses": [
    "It does not disguise an advertisement as neutral research or fabricate benchmark data.",
    "It does not require unnecessary personal data or preselect promotional consent.",
    "It does not withhold the promised core behind a sales call or surprise paywall."
  ],
  "execution": {
    "mode": "prompt",
    "entrypoints": []
  },
  "adapters": {
    "claude-code": "adapters/claude-code.json",
    "codex": "adapters/codex.json",
    "gemini-cli": "adapters/gemini-cli.json",
    "github-copilot": "adapters/github-copilot.json",
    "cursor": "adapters/cursor.json",
    "opencode": "adapters/opencode.json"
  },
  "capabilities": [
    "plan"
  ],
  "relationships": {
    "composesWith": [],
    "conflictsWith": [],
    "supersedes": [],
    "prerequisites": [],
    "packIds": []
  },
  "operational": {
    "behavior": "advisory",
    "failurePolicy": "stop-and-report",
    "latencyClass": "bounded",
    "latency_reason": "The skill designs an optional resource that delivers standalone value and signals genuine customer fit, using sequential evidence and verification steps.",
    "dataRetention": "runtime-managed"
  }
}
